{
 "title": "Hollow Ground",
 "slug": "hollow-ground",
 "logline": "The cabin had been empty since the Harlan family left in a hurry in the autumn of 1987.",
 "protagonist": {
  "name": "Not",
  "eye_height_m": 1.65
 },
 "scenes": [
  {
   "id": "kitchen_night_1",
   "name": "Kitchen (night)",
   "layers": {
    "base": "interior",
    "setting": "kitchen",
    "era": "modern",
    "genre_mood": "horror",
    "weather": "clear",
    "time": "night",
    "state": "lived-in"
   },
   "generator": "KITCHEN",
   "seed": 7,
   "spawn": {
    "focus": "room"
   },
   "focus_points": [
    "stove"
   ]
  },
  {
   "id": "forest_dusk_2",
   "name": "Forest (dusk)",
   "layers": {
    "base": "landscape",
    "setting": "forest",
    "era": "modern",
    "genre_mood": "horror",
    "weather": "clear",
    "time": "dusk",
    "state": "lived-in"
   },
   "generator": "COMPOSED",
   "seed": 11,
   "spawn": {
    "focus": "landmark"
   },
   "focus_points": [
    "landmark",
    "tree"
   ]
  },
  {
   "id": "kitchen_dusk_3",
   "name": "Kitchen (dusk)",
   "layers": {
    "base": "interior",
    "setting": "kitchen",
    "era": "modern",
    "genre_mood": "horror",
    "weather": "clear",
    "time": "dusk",
    "state": "lived-in"
   },
   "generator": "KITCHEN",
   "seed": 1,
   "spawn": {
    "focus": "room"
   },
   "focus_points": [
    "cupboards"
   ]
  },
  {
   "id": "kitchen_night_4",
   "name": "Kitchen (night)",
   "layers": {
    "base": "interior",
    "setting": "kitchen",
    "era": "modern",
    "genre_mood": "horror",
    "weather": "clear",
    "time": "night",
    "state": "lived-in"
   },
   "generator": "KITCHEN",
   "seed": 7,
   "spawn": {
    "focus": "room"
   },
   "focus_points": [
    "doorway"
   ]
  },
  {
   "id": "forest_night_5",
   "name": "Forest (night)",
   "layers": {
    "base": "landscape",
    "setting": "forest",
    "era": "modern",
    "genre_mood": "horror",
    "weather": "clear",
    "time": "night",
    "state": "lived-in"
   },
   "generator": "COMPOSED",
   "seed": 11,
   "spawn": {
    "focus": "landmark"
   },
   "focus_points": [
    "path"
   ]
  },
  {
   "id": "forest_dawn_6",
   "name": "Forest (dawn)",
   "layers": {
    "base": "landscape",
    "setting": "forest",
    "era": "modern",
    "genre_mood": "horror",
    "weather": "clear",
    "time": "dawn",
    "state": "lived-in"
   },
   "generator": "COMPOSED",
   "seed": 23,
   "spawn": {
    "focus": "landmark"
   },
   "focus_points": [
    "tree"
   ]
  },
  {
   "id": "graveyard_dawn_7",
   "name": "Graveyard (dawn)",
   "layers": {
    "base": "landscape",
    "setting": "graveyard",
    "era": "modern",
    "genre_mood": "horror",
    "weather": "clear",
    "time": "dawn",
    "state": "lived-in"
   },
   "generator": "COMPOSED",
   "seed": 7,
   "spawn": {
    "focus": "landmark"
   },
   "focus_points": [
    "graves",
    "path"
   ]
  },
  {
   "id": "basement_dawn_8",
   "name": "Basement (dawn)",
   "layers": {
    "base": "interior",
    "setting": "basement",
    "era": "modern",
    "genre_mood": "horror",
    "weather": "clear",
    "time": "dawn",
    "state": "lived-in"
   },
   "generator": "COMPOSED",
   "seed": 11,
   "spawn": {
    "focus": "room"
   },
   "focus_points": [
    "door",
    "machines"
   ]
  }
 ],
 "beats": [
  {
   "id": "b01",
   "scene_id": "kitchen_night_1",
   "shot": {
    "type": "establishing",
    "focus": "stove",
    "camera_move": "push_in",
    "duration_s": 3.5
   },
   "trigger": {
    "type": "focus",
    "focus": "stove",
    "radius_m": 3.0
   },
   "caption": "The cabin had been empty since the Harlan family left in a hurry in the autumn of 1987."
  },
  {
   "id": "b02",
   "scene_id": "forest_dusk_2",
   "shot": {
    "type": "establishing",
    "focus": "landmark",
    "camera_move": "drift",
    "duration_s": 3.5
   },
   "trigger": {
    "type": "focus",
    "focus": "landmark",
    "radius_m": 3.0
   },
   "caption": "Nell bought it for almost nothing and drove up through the forest at dusk. The pines closed over the road like a held breath."
  },
  {
   "id": "b03",
   "scene_id": "forest_dusk_2",
   "shot": {
    "type": "close",
    "focus": "tree",
    "camera_move": "static",
    "duration_s": 3.0
   },
   "trigger": {
    "type": "focus",
    "focus": "tree",
    "radius_m": 3.0
   },
   "caption": "When she cut the engine, nothing sang. Not a bird."
  },
  {
   "id": "b04",
   "scene_id": "kitchen_dusk_3",
   "shot": {
    "type": "establishing",
    "focus": "cupboards",
    "camera_move": "pan_right",
    "duration_s": 3.5
   },
   "trigger": {
    "type": "focus",
    "focus": "cupboards",
    "radius_m": 3.0
   },
   "caption": "Not an insect. Inside, the table was still set for four."
  },
  {
   "id": "b05",
   "scene_id": "kitchen_night_4",
   "shot": {
    "type": "establishing",
    "focus": "doorway",
    "camera_move": "tilt_up",
    "duration_s": 3.5
   },
   "trigger": {
    "type": "focus",
    "focus": "doorway",
    "radius_m": 3.0
   },
   "caption": "Dust lay on the plates in a perfect grey snow. That night something knocked on the door three times."
  },
  {
   "id": "b06",
   "scene_id": "forest_night_5",
   "shot": {
    "type": "establishing",
    "focus": "path",
    "camera_move": "pull_out",
    "duration_s": 3.5
   },
   "trigger": {
    "type": "focus",
    "focus": "path",
    "radius_m": 3.0
   },
   "caption": "Nell opened it. There was no one there, only the dark trees and a path of small footprints leading away."
  },
  {
   "id": "b07",
   "scene_id": "forest_dawn_6",
   "shot": {
    "type": "establishing",
    "focus": "tree",
    "camera_move": "orbit",
    "duration_s": 3.5
   },
   "trigger": {
    "type": "focus",
    "focus": "tree",
    "radius_m": 3.0
   },
   "caption": "She followed them at first light."
  },
  {
   "id": "b08",
   "scene_id": "graveyard_dawn_7",
   "shot": {
    "type": "establishing",
    "focus": "graves",
    "camera_move": "pan_left",
    "duration_s": 3.5
   },
   "trigger": {
    "type": "focus",
    "focus": "graves",
    "radius_m": 3.0
   },
   "caption": "They ended at the old graveyard behind the ridge, among leaning headstones and a rusted iron fence. Four new stones stood in the front row."
  },
  {
   "id": "b09",
   "scene_id": "graveyard_dawn_7",
   "shot": {
    "type": "OTS",
    "focus": "path",
    "camera_move": "push_in",
    "duration_s": 3.0
   },
   "trigger": {
    "type": "focus",
    "focus": "path",
    "radius_m": 3.0
   },
   "caption": "The names were Harlan. The dates were next year."
  },
  {
   "id": "b10",
   "scene_id": "graveyard_dawn_7",
   "shot": {
    "type": "wide",
    "focus": "graves",
    "camera_move": "drift",
    "duration_s": 3.0
   },
   "trigger": {
    "type": "focus",
    "focus": "graves",
    "radius_m": 3.0
   },
   "caption": "whispered a voice behind the fence. When she turned, the graveyard was empty.",
   "dialogue": [
    {
     "speaker": "VOICE",
     "text": "You shouldn't be here"
    }
   ]
  },
  {
   "id": "b11",
   "scene_id": "basement_dawn_8",
   "shot": {
    "type": "establishing",
    "focus": "door",
    "camera_move": "static",
    "duration_s": 3.5
   },
   "trigger": {
    "type": "focus",
    "focus": "door",
    "radius_m": 3.0
   },
   "caption": "Back at the cabin the basement door stood open. It had been nailed shut when she arrived."
  },
  {
   "id": "b12",
   "scene_id": "basement_dawn_8",
   "shot": {
    "type": "close",
    "focus": "machines",
    "camera_move": "pan_right",
    "duration_s": 3.0
   },
   "trigger": {
    "type": "focus",
    "focus": "machines",
    "radius_m": 3.0
   },
   "caption": "Down there, beside the old boiler and the shelves of jars, someone had chalked a fifth name on the wall. It was hers."
  }
 ]
}